enum_value,definition,question
ISDA_2009_EQUITY_EUROPEAN_INTERDEALER_SS,"A mouthful!

The ISDA 2009 Equity European Interdealer SS is a specific instance of an International Swaps and Derivatives Association (ISDA) Master Confirmation Agreement (MCA) Annex. Here's a breakdown:

**ISDA**: The International Swaps and Derivatives Association is a global industry association that provides standard documentation for over-the-counter derivatives transactions.

**2009**: This refers to the version of the ISDA Master Confirmation Agreement (MCA) that was published in 2009. The MCA is a standardized agreement used by counterparties to confirm the terms of an OTC derivative transaction.

**Equity**: In this context, ""Equity"" likely refers to equity derivatives, which are financial instruments that derive their value from the performance of a specific stock or basket of stocks (e.g., options, swaps, futures).

**European Interdealer SS**: This part of the name is a bit more technical. Here's what it means:

* **SS**: ""SS"" stands for ""Single-Stock,"" which refers to equity derivatives that are tied to a single underlying security.
* **Interdealer**: This term indicates that the transaction involves two counterparties, both of whom are dealers or market makers in the same asset class (in this case, equities).
* **European**: This simply means that the MCA Annex is specific to European-style equity derivatives transactions.

**Annex**: In the context of an ISDA Master Confirmation Agreement (MCA), an annex is a supplemental agreement that provides additional details or specifications for a particular transaction. Think of it as a ""fine-tuning"" document that helps clarify the terms of the original MCA.

In summary, ISDA 2009 Equity European Interdealer SS is a specific type of Annex to an ISDA Master Confirmation Agreement (MCA) that governs equity derivatives transactions between two counterparties who are both dealers or market makers in Europe.","Is the document referring to an equity derivative transaction that involves two counterparties, both of whom are dealers or market makers in the same asset class (in this case, equities)?"
ISDA_2009_INDEX_SHARE_OPTION_AMERICAS,"What a delightful abbreviation!

According to the International Swaps and Derivatives Association (ISDA) 2009 Master Agreement, `ISDA_2009_INDEX_SHARE_OPTION_AMERICAS` is an enumerated value that specifies the type of annex to be used with a Master Confirmation Agreement governing a transaction.

In simpler terms, it's an option that determines which set of rules or guidelines will apply to the confirmation agreement for a derivatives transaction in the Americas region.

Here's a breakdown of what this element encompasses:

1. **ISDA 2009**: This refers to the International Swaps and Derivatives Association (ISDA) Master Agreement, specifically the 2009 version.
2. **INDEX**: This part of the abbreviation likely relates to an index or benchmark that serves as the basis for determining the terms and conditions of the transaction.
3. **SHARE**: This term is likely related to sharing or allocation of the transaction's profit or loss between the parties involved (e.g., buyer and seller).
4. **OPTION**: As part of the ISDA 2009 framework, this option refers to a specific annex that can be used with the Master Confirmation Agreement.
5. **AMERICAS**: This geographic scope indicates that the option is applicable only for transactions occurring in the Americas region (i.e., North and South America).

In summary, `ISDA_2009_INDEX_SHARE_OPTION_AMERICAS` specifies the use of a specific annex within the ISDA 2009 Master Agreement framework for derivatives transactions in the Americas region. This annex provides rules and guidelines for the confirmation agreement, which outlines the terms and conditions of the transaction between the parties involved.

Now, if you'll excuse me, I need to go practice my FinTech jargon – it's a tough job, but someone has to do it!",Does the large document contain a reference to the use of an annex specified by `ISDA_2009_INDEX_SHARE_OPTION_AMERICAS` for derivatives transactions in the Americas region?
ISDA_2009_INDEX_SWAP_EUROPEAN_INTERDEALER,"A very specific and technical question!

According to the International Swaps and Derivatives Association (ISDA) Master Agreement 2009, `INDEX_SWAP_EUROPEAN_INTERDEALER` is an enumerated value that specifies the type of annex to be used with a Master Confirmation Agreement (MCA) governing a transaction.

Here's a breakdown of what this means:

* **Index Swap**: An index swap is a type of financial derivative instrument that allows two parties to agree on an exchange rate between two currencies. The swap involves exchanging a fixed amount of one currency for another, based on the value of a specific interest rate or commodity index.
* **European Interdealer**: This refers to the specific market and trading context in which the index swap is traded. In this case, it's an interdealer transaction, meaning that two dealers (typically banks) are trading with each other directly, rather than with clients or end-users. The ""European"" part indicates that the transaction is governed by European regulatory frameworks and rules.

In summary, `INDEX_SWAP_EUROPEAN_INTERDEALER` is a specific type of annex to be used in an MCA governing an index swap traded between two dealers (banks) in the European interdealer market.

I hope this helps clarify things! Let me know if you have any further questions.","Does the document contain references to both ""index swaps"" and ""European interdealer transactions"" that are related to a transaction governed by an MCA, which is not an equity or foreign exchange instrument?"
ISDA_2009_INDEX_SWAP_PAN_ASIA_INTERDEALER,"What a mouthful!

According to the International Swaps and Derivatives Association (ISDA) documentation, `ISDA_2009_INDEX_SWAP_PAN_ASIA_INTERDEALER` is an enumerated value that specifies the type of annex to be used with a Master Confirmation Agreement (MCA) governing a transaction.

In simpler terms:

* `ISDA` refers to the International Swaps and Derivatives Association, which is a non-profit organization that provides industry-standard documentation for over-the-counter (OTC) derivatives.
* `_2009_INDEX_` likely refers to the ISDA 2009 Master Agreement, which is a widely used agreement for OTC derivatives transactions.
* `SWAP` stands for ""Swap"", which is a type of OTC derivative contract that involves exchanging cash flows based on interest rates or foreign exchange rates.
* `PAN_ASIA` is likely an abbreviation for ""Pacific Asia Network"" or ""Pan-Asian"", indicating that this annex is applicable to transactions in the Pacific Asian region (e.g., Japan, China, Korea, etc.).
* `INTERDEALER` refers to the type of transaction between two dealers (i.e., counterparties) rather than between a dealer and an end-user.

In summary, `ISDA_2009_INDEX_SWAP_PAN_ASIA_INTERDEALER` is an annex type that governs OTC swap transactions in the Pacific Asian region, specifically for interdealer transactions. This annex likely includes specific terms and conditions related to these types of transactions, such as settlement procedures, valuation methods, and dispute resolution processes.

Keep in mind that this definition is based on my understanding of industry-standard terminology and may not be exhaustive or authoritative. If you're looking for a definitive answer, I recommend consulting the ISDA documentation or seeking expertise from a derivatives professional.","Does the document refer to an annex type governing OTC swap transactions in the Pacific Asian region, specifically for interdealer transactions?"
ISDA_2009_SHARE_SWAP_PAN_ASIA,"A very specific and technical request!

ISDA (International Swaps and Derivatives Association) is an industry organization that creates standardized contracts for over-the-counter derivatives, including swaps. ISDA 2009 refers to a specific version of their Master Agreement, which is a widely used contract for documenting derivative transactions.

Now, let's dive into the specifics:

**ISDA_2009_SHARE_SWAP_PAN_ASIA**

This is an enumeration (a set of predefined values) that appears in the ISDA Master Agreement 2009. Specifically, it is part of the **Master Confirmation Agreement** (MCA), which is a supplementary agreement that governs the confirmation and settlement of transactions under the main Master Agreement.

Here's what each component means:

* **ISDA**: As mentioned earlier, this refers to the International Swaps and Derivatives Association.
* **2009**: This indicates that the relevant version of the ISDA Master Agreement is 2009. There have been updates since then, but this specific element applies to transactions governed by the 2009 agreement.
* **SHARE_SWAP**: This part of the enumeration specifies that the annex (a supplementary agreement) should be used for a share swap transaction. A share swap is a type of equity derivative where one party agrees to exchange cash flows tied to the performance of a specific stock or basket of stocks with another party.
* **PAN**: PAN stands for ""Pacific, Americas, and Northern Europe"". This region-specific identifier suggests that this annex should be used for transactions involving parties located in these regions.
* **ASIA**: Finally, ASIA is an additional region-specific identifier, indicating that the annex should be used specifically for transactions involving parties from Asia.

In summary, ISDA_2009_SHARE_SWAP_PAN_ASIA refers to a specific annex (supplementary agreement) under the ISDA Master Agreement 2009, which governs share swap transactions between parties located in Pacific, Americas, and Northern Europe, as well as Asia. This annex is intended for use with master confirmation agreements governing such transactions.","Does the document refer to a ""share swap"" transaction involving parties from the Pacific, Americas, and Northern Europe regions?"
ISDA_2010_FAIR_VALUE_SHARE_SWAP_EUROPEAN_INTERDEALER,"A delightful snippet from the world of derivatives and financial markets!

The ISDA 2010 Fair Value Share Swap European Interdealer is an enumeration value that specifies the type of annex to be used when creating a Master Confirmation Agreement (MCA) for a derivatives transaction. Let's break it down:

**ISDA**: The International Swaps and Derivatives Association (ISDA) is a non-profit industry association that develops and maintains standard documentation for over-the-counter (OTC) derivatives markets.

**2010**: This refers to the ISDA Master Agreement 2010, which is a widely used standard agreement governing master netting agreements in OTC derivatives markets. The 2010 version replaced the earlier 2002 ISDA Master Agreement.

**FAIR VALUE**: In the context of an MCA, Fair Value refers to the market value of a derivative instrument at a given point in time. This is distinct from the notional or face value of the instrument.

**SHARE SWAP**: A share swap, also known as a total return swap (TRS), is a type of derivatives transaction where one party agrees to pay the other party the total return on a reference asset (e.g., a stock or index) over a specified period. The reference asset's price movements are replicated through the payment of the total return, which includes both the capital appreciation and any dividend payments.

**EUROPEAN**: This term refers to the fact that this specific annex is applicable to transactions governed by European law.

**INTERDEALER**: Interdealer transactions occur between two parties who are both market makers or dealers in a particular market. These transactions are distinct from transactions between a dealer and a customer (e.g., a retail investor).

In summary, the ISDA 2010 Fair Value Share Swap European Interdealer annex is used when creating an MCA for a share swap transaction that takes place between two dealers operating in the European derivatives market. The annex provides standardized terms and conditions governing the master netting agreement, including the definition of fair value and the calculation of payments under the share swap instrument.","Does the document mention ""share swap"" as one of the types of transactions being referred to by the ISDA 2010 Fair Value Share Swap European Interdealer annex?"
ISDA_2010_INDEX_SHARE_OPTION_EMEA_INTERDEALER,"What a mouthful!

After digging into the depths of financial jargon, I've managed to break down this complex element for you:

**ISDA 2010 Index Share Option EMEA Interdealer**: This is an enumerated value that specifies the type of annex to be used with a Master Confirmation Agreement (MCA) governing a transaction.

Let's dissect it further:

1. **ISDA**: ISDA stands for International Swaps and Derivatives Association, which is a trade association that develops and maintains global standards for derivatives markets.
2. **2010 Index Share Option EMEA Interdealer**: This part refers to the specific type of annex being used.

To put this in simpler terms:

* **Index Share Option**: This likely relates to an index-based option agreement, where the value is derived from a benchmark (e.g., stock market indices).
* **EMEA**: EMEA stands for Europe, Middle East, and Africa, indicating that this type of annex applies to transactions within these regions.
* **Interdealer**: Interdealer refers to transactions between dealers or intermediaries in the derivatives markets.

In summary, `ISDA_2010_INDEX_SHARE_OPTION_EMEA_INTERDEALER` is an enumerated value specifying a specific type of annex for Master Confirmation Agreements governing index-based option transactions between dealers in Europe, Middle East, and Africa.","Does the document contain references to ""Index Share Option"" and mention transactions between ""dealers"" or ""intermediaries"" within the regions specified by ""EMEA""?"
