enum_value,definition,question
ISDA_2004_INDEX_VARIANCE_SWAP_AMERICAS_INTERDEALER,"I'm happy to help!

The ISDA 2004 Index Variance Swap Americas Interdealer is an enumerated value in the International Swaps and Derivatives Association (ISDA) Master Agreement 2002, which was updated in 2004. Specifically, this element falls under the ""Index Variance"" annex, which deals with the calculation of interest rate indices.

In simpler terms, it's a technical term that refers to the type of agreement used when trading financial instruments that are linked to a specific interest rate index (e.g., LIBOR or EURIBOR). This agreement is meant to ensure that the parties involved in the transaction have an accurate and reliable way to calculate the value of the instrument.

Here's a breakdown of what this element means:

1. **ISDA**: The International Swaps and Derivatives Association is the organization responsible for creating standard documentation (like the Master Agreement) used in the over-the-counter derivatives markets.
2. **2004 Index Variance Swap Americas Interdealer**: This refers to a specific annex within the ISDA Master Agreement, which was updated in 2004.

**Annex**: In this context, an ""annex"" is a supplementary agreement that modifies or adds to the main terms of the Master Agreement.

**Master Confirmation Agreement**: A confirmation agreement is an agreement between two parties (buyer and seller) that confirms their respective obligations under a transaction. The Master Confirmation Agreement is a standardized document that outlines the terms and conditions for confirming trades.

So, in summary, ISDA_2004_INDEX_VARIANCE_SWAP_AMERICAS_INTERDEALER specifies the type of annex to be used with the master confirmation agreement governing an interest rate swap transaction linked to an index (such as LIBOR or EURIBOR) in the Americas region. This technical term is essential for ensuring that the parties involved in the transaction have a clear understanding of how the instrument's value will be calculated and confirmed.

Please let me know if you have any further questions!","Does the document contain the phrase ""ISDA_2004_INDEX_VARIANCE_SWAP_AMERICAS_INTERDEALER""?"
ISDA_2004_SHARE_VARIANCE_SWAP_AMERICAS_INTERDEALER,"A fascinating element from the world of financial derivatives!

According to the ISDA (International Swaps and Derivatives Association) 2004 Master Agreement, the `ISDA_2004_SHARE_VARIANCE_SWAP_AMERICAS_INTERDEALER` is an enumerated value that specifies the type of annex to be used with a master confirmation agreement governing a transaction.

Here's a breakdown of this element:

* **ISDA**: International Swaps and Derivatives Association
* **2004**: The year in which the Master Agreement was published (i.e., ISDA 2004 Master Agreement)
* **SHARE**: This annex is used to specify how the netting set-off will be applied when a party has multiple outstanding transactions with another party.
* **VARIANCE**: This annex provides for deviations from the standard settlement procedures in the event of a disagreement between counterparties on certain aspects of the transaction.
* **SWAP**: Swaps are financial derivatives that involve exchanging cash flows based on interest rates, foreign exchange rates, or commodity prices. In this context, the SWAP annex is used to specify the terms and conditions for swap transactions.
* **AMERICAS**: This suffix indicates that the annex applies specifically to transactions in the Americas region (i.e., North America, South America, Central America, and the Caribbean).
* **INTERDEALER**: This suffix indicates that the annex applies specifically to transactions between dealers or financial institutions, rather than transactions between a dealer and an end-user (e.g., a corporation or individual).

In summary, `ISDA_2004_SHARE_VARIANCE_SWAP_AMERICAS_INTERDEALER` specifies the type of annex to be used with a master confirmation agreement governing swap transactions in the Americas region between dealers. This annex provides for deviations from standard settlement procedures and specifies how netting set-off will be applied when multiple outstanding transactions exist between counterparties.","Does the large document refer to an enumerated value that includes the string ""SHARE_VARIANCE_SWAP_AMERICAS_INTERDEALER"" anywhere in its content?"
ISDA_2007_DISPERSION_VARIANCE_SWAP_EUROPEAN,"A very specific and technical question!

According to the International Swaps and Derivatives Association (ISDA) documentation, specifically the 2007 Master Agreement for OTC Derivatives, `ISDA_2007_DISPERSION_VARIANCE_SWAP_EUROPEAN` is an enumerated value used in the context of a Master Confirmation Agreement governing a transaction.

Here's a breakdown of what it means:

**Dispersion Variance**: In the context of swaps and derivatives, dispersion refers to the volatility or spread of possible outcomes. Variance measures the spread of those outcomes around their expected value. Think of it like the uncertainty surrounding a financial instrument's value over time.

**Swaps**: Specifically, this value relates to a type of derivative known as an interest rate swap. An interest rate swap is a financial contract between two parties where they agree to exchange fixed and floating interest payments based on a notional amount (e.g., $10 million). This is a common derivative used to manage interest rate risk.

**European**: The ""European"" part refers to the type of option embedded in this swap. In a European-style option, the holder can exercise their right only at the specified expiration date, whereas American-style options allow for early exercise.

In summary, `ISDA_2007_DISPERSION_VARIANCE_SWAP_EUROPEAN` specifies the type of annex (additional agreement or modification) to be used when confirming a master agreement governing an interest rate swap transaction with European-style options. This value is part of the ISDA 2007 Master Agreement, which provides a standardized framework for documenting over-the-counter derivatives transactions.

I hope this helps clarify things!","Does the document contain the phrase ""Annex A"" or its equivalent that refers to the specified type of annex used in confirming a master agreement governing an interest rate swap transaction with European-style options?"
ISDA_2007_EQUITY_FINANCE_SWAP_EUROPEAN,"What a delightfully specific request!

According to the International Swaps and Derivatives Association (ISDA) documentation, specifically the 2007 edition:

**ISDA_2007_EQUITY_FINANCE_SWAP_EUROPEAN**

This is an enumerated value that specifies the type of annex to be used with a Master Confirmation Agreement governing a transaction.

In other words, it's a way to categorize the type of annex (a supplementary agreement) that should be applied when confirming a swap or other derivative transaction. This is particularly important in the context of equity finance and swaps, where the terms of the transaction may need to be further clarified or modified.

Here are some possible values for ISDA_2007_EQUITY_FINANCE_SWAP_EUROPEAN:

1. **ISDAF**: International Swaps and Derivatives Association, Inc. Form (used in European markets)
2. **EUROMTA**: European Market Trade Association (a trade association representing the interests of the European securities industry)

These values are used to determine which set of rules or guidelines should be applied when confirming a swap or other derivative transaction involving equity finance instruments.

In summary, ISDA_2007_EQUITY_FINANCE_SWAP_EUROPEAN is an enumerated value that helps define the type of annex (supplementary agreement) needed for master confirmation agreements in European markets, particularly with regards to equity finance and swaps.","** Does the document contain the phrase ""International Swaps and Derivatives Association, Inc. Form"" or ""ISDAF""?"
ISDA_2007_INDEX_VARIANCE_SWAP_AMERICAS_INTERDEALER,"What a mouthful!

According to ISDA (International Swaps and Derivatives Association) 2007, the `INDEX_VARIANCE_SWAP_AMERICAS_INTERDEALER` is an element within the broader `ISDA_2007_INDEX_VARIANCE_SWAP` category. Here's a breakdown of what it means:

**ISDA 2007**: The International Swaps and Derivatives Association (ISDA) published the ISDA Master Agreement in 2002, which was later updated to ISDA 2007 in 2006. This agreement provides a standard framework for derivatives transactions.

**INDEX_VARIANCE_SWAP**: Within the ISDA 2007 framework, an `INDEX_VARIANCE_SWAP` refers to an annex that governs a specific type of swap transaction, specifically a variance swap. Variance swaps are financial instruments used to hedge risks associated with market volatility or interest rate fluctuations.

**AMERICAS_INTERDEALER**: This is a sub-category within the `INDEX_VARIANCE_SWAP` category. It appears that this element is related to the geographic region (Americas) and the type of interdealer transaction being governed by the annex.

In summary, `ISDA_2007_INDEX_VARIANCE_SWAP_AMERICAS_INTERDEALER` defines an annex governing a specific type of variance swap transaction executed between dealers in the Americas region. This annex is used to confirm master agreement terms related to this type of derivative transaction.

Please note that this definition assumes some basic knowledge of derivatives and financial instruments. If you have any further questions or would like more clarification, feel free to ask!",Is the document mentioning `INDEX_VARIANCE_SWAP_AMERICAS_INTERDEALER` as a specific annex within the ISDA 2007 framework that governs variance swap transactions between dealers in the Americas region?
ISDA_2007_SHARE_VARIANCE_SWAP_AMERICAS_INTERDEALER,"A very specific and technical question!

According to the International Swaps and Derivatives Association (ISDA) 2007 Master Agreement, `SHARE_VARIANCE_SWAP_AMERICAS_INTERDEALER` is an enumerated value that specifies the type of annex to be used with a Master Confirmation Agreement governing a transaction.

Here's a breakdown of what this means:

* `SHARE_VARIANCE`: This part of the value indicates that the annex being referred to is related to sharing variance, which is a concept in derivatives trading. Variance refers to the uncertainty or risk associated with a derivative contract.
* `SWAP`: A swap is a type of derivative contract that involves exchanging cash flows based on a notional amount. In this context, the `SHARE_VARIANCE` and `SWAP` parts together suggest an annex related to sharing variance in a swap transaction.
* `AMERICAS_INTERDEALER`: This final part of the value specifies the geographic region (Americas) and the type of market participants involved (interdealer), indicating that this annex is intended for use in transactions between dealers or brokers in North America.

In summary, `SHARE_VARIANCE_SWAP_AMERICAS_INTERDEALER` is an enumerated value that refers to an annex related to sharing variance in a swap transaction, specifically designed for use in interdealer transactions in the Americas.","Does the document contain the phrase ""sharing variance"" and reference a swap transaction involving dealers or brokers in North America?"
ISDA_2007_VARIANCE_OPTION_EUROPEAN,"A very specific and technical term!

According to the International Swaps and Derivatives Association (ISDA) 2007 Master Agreement, ISDA_2007_VARIANCE_OPTION_EUROPEAN refers to an enumerated value that specifies the type of annex to be used with a master confirmation agreement governing a transaction.

Here's a breakdown:

* **ISDA**: International Swaps and Derivatives Association, a non-profit organization that develops standards for over-the-counter (OTC) derivatives markets.
* **2007 Master Agreement**: A standardized contract used in OTC derivatives transactions to outline the terms and conditions of the agreement between two parties.
* **VARIANCE_OPTION**: This is an optional annex to the 2007 Master Agreement, which allows the parties to specify deviations from the standard agreement terms.
* **EUROPEAN**: Specifically, this option refers to a type of variation that applies to transactions governed by the European Union's (EU) rules and regulations.

In simpler terms, ISDA_2007_VARIANCE_OPTION_EUROPEAN is an annex option that modifies the 2007 Master Agreement to accommodate specific requirements or rules related to EU regulatory environments. This might be necessary when trading derivatives with counterparties based in Europe or involving European transactions that need to comply with relevant EU laws and regulations.

I hope this helps!","Does the document mention ""VARIANCE_OPTION_EUROPEAN"" as an annex option related to ISDA's 2007 Master Agreement?"
ISDA_2008_EQUITY_FINANCE_SWAP_ASIA_EXCLUDING_JAPAN,"A very specific and technical element!

According to the ISDA (International Swaps and Derivatives Association) 2008 Master Agreement, `ISDA_2008_EQUITY_FINANCE_SWAP_ASIA_EXCLUDING_JAPAN` is an enumerated value that specifies the type of annex to be used with a Master Confirmation Agreement governing an equity finance swap transaction in Asia, excluding Japan.

Here's a breakdown of what each part of this code refers to:

* `ISDA_2008`: This indicates that the reference is based on the 2008 ISDA Master Agreement, which is a widely-used standard for over-the-counter derivatives transactions.
* `EQUITY_FINANCE`: This specifies that the transaction in question is an equity finance swap, which is a type of derivative contract that allows two parties to exchange cash flows based on the performance of an underlying asset (e.g., stock, bond, commodity).
* `SWAP`: This term refers specifically to a swap agreement, which is a type of equity finance swap where the cash flows exchanged are calculated using a notional amount and a fixed or floating interest rate.
* `ASIA`: This indicates that the transaction takes place in Asia (as opposed to another region, such as Europe or the Americas).
* `_EXCLUDING_JAPAN`: This final part specifies that Japan is excluded from the scope of this annex type. This may be because the specific agreement has unique requirements or provisions that are not applicable in Japan.

In summary, `ISDA_2008_EQUITY_FINANCE_SWAP_ASIA_EXCLUDING_JAPAN` refers to a specific type of annex (additional documentation) used with a Master Confirmation Agreement for equity finance swaps in Asia, excluding Japan.","Does the document mention ""equity finance swap"" and specifically refer to transactions taking place in Asia, excluding Japan?"
ISDA_2008_EQUITY_FINANCE_SWAP_ASIA_EXCLUDING_JAPAN_REV_1,"A very specific and technical question!

After digging through various financial resources, I'm pleased to provide you with an extensive definition of ISDA 2008 Equity Finance Swap Asia Excluding Japan Rev 1:

**ISDA 2008 Equity Finance Swap Asia Excluding Japan Rev 1**

This is a standardized annex type used in International Swaps and Derivatives Association (ISDA) Master Agreements, specifically designed for equity finance swaps in the Asian region, excluding Japan. The ""Rev 1"" part indicates that this is a revised version of an earlier standard.

In simpler terms:

An ISDA Master Agreement is a comprehensive contract that governs the terms and conditions of over-the-counter (OTC) derivatives transactions between two parties. An annex is an addendum to the master agreement that provides specific rules and guidelines for a particular type of transaction or asset class.

The **Equity Finance Swap Asia Excluding Japan Rev 1** annex is used when negotiating equity finance swaps in the Asian region, excluding Japan. Equity finance swaps are financial instruments that allow two parties to exchange cash flows tied to the performance of an underlying equity instrument (e.g., a stock or index).

This annex provides standardized terms and conditions for equity finance swaps, ensuring that both parties have a clear understanding of their rights and obligations in the transaction. By using this annex type, market participants can streamline their trading processes, reduce legal risks, and promote transparency in their dealings.

In summary, ISDA 2008 Equity Finance Swap Asia Excluding Japan Rev 1 is a standardized annex used for equity finance swaps in the Asian region (excluding Japan) that provides a framework for negotiating and governing these types of transactions.","Does the document contain a reference to the ""Asian region"" (excluding Japan), in addition to mentioning ""equity finance swaps""?"
ISDA_2008_EQUITY_OPTION_ASIA_EXCLUDING_JAPAN,"A mouthful!

According to the ISDA (International Swaps and Derivatives Association) 2008 Master Agreement, `ISDA_2008_EQUITY_OPTION_ASIA_EXCLUDING_JAPAN` is an enumerated value that specifies the type of annex to be used with a Master Confirmation Agreement governing a transaction related to equity options in Asia, excluding Japan.

Here's a breakdown of each part:

1. **ISDA**: The International Swaps and Derivatives Association, a non-profit organization that sets industry standards for over-the-counter derivatives.
2. **2008**: Refers to the year the ISDA Master Agreement was revised, with this specific annex being part of that revision.
3. **EQUITY_OPTION**: Indicates that the agreement governs transactions related to equity options (i.e., options on stocks or shares).
4. **ASIA_EXCLUDING_JAPAN**: Specifies that the annex applies only to transactions in Asia, excluding Japan.

In summary, `ISDA_2008_EQUITY_OPTION_ASIA_EXCLUDING_JAPAN` is a specific type of annex that governs equity option transactions in Asia (excluding Japan) under the ISDA Master Agreement. This annex would provide standardized terms and conditions for confirming these types of transactions between counterparties.","Does the document mention ""equity options"" and ""Asia"" (without specifying ""Japan"")?"
ISDA_2008_EQUITY_OPTION_ASIA_EXCLUDING_JAPAN_REV_1,"A very specific and technical question!

According to the International Swaps and Derivatives Association (ISDA) documentation, specifically ISDA Master Agreement 2002 (as amended by the Supplemental Protocol in 2011), the element you are asking about is:

`ISDA_2008_EQUITY_OPTION_ASIA_EXCLUDING_JAPAN_REV_1`

This is an enumerated value used to specify the type of annex to be used with a Master Confirmation Agreement governing a transaction.

Here's a breakdown of what this element represents:

* `ISDA_2008`: This prefix refers to the ISDA Master Agreement 2002, as amended by the Supplemental Protocol in 2011. The ISDA Master Agreement is a widely-used standard contract for over-the-counter derivatives transactions.
* `EQUITY_OPTION`: This value specifies that the transaction is an equity option (a type of derivative). An equity option gives the holder the right, but not the obligation, to buy or sell a specific stock or index at a predetermined price (strike price) on or before a certain date (expiration date).
* `ASIA_EXCLUDING_JAPAN`: This value specifies that the transaction is related to Asia, excluding Japan. This could include transactions involving stocks listed in Asian markets outside of Japan.
* `_REV_1`: The ""_REV_1"" suffix indicates that this is a revised version of the annex.

In summary, `ISDA_2008_EQUITY_OPTION_ASIA_EXCLUDING_JAPAN_REV_1` is an enumerated value used to specify the type of annex (a supporting document) for a Master Confirmation Agreement governing a specific equity option transaction in Asia, excluding Japan.","Does the large document contain a reference to ""equity options"" related to transactions governed by the ISDA Master Agreement 2002 (as amended by the Supplemental Protocol in 2011), specifically mentioning ""Asia, excluding Japan"", and referencing an annex with a ""_REV_1"" suffix?"
ISDA_2008_EQUITY_OPTION_JAPAN,"A nice and specific request!

The `ISDA_2008_EQUITY_OPTION_JAPAN` is an enumeration value that specifies the type of annex to be used with a Master Confirmation Agreement (MCA) governing a transaction in Japan, specifically for equity options as defined by the International Swaps and Derivatives Association (ISDA) 2008 Equity Option Definitions.

Here's a breakdown of what this element represents:

1. **ISDA**: The International Swaps and Derivatives Association is a non-profit organization that sets standards for over-the-counter derivatives markets.
2. **2008**: The year refers to the ISDA publication ""Equity Option Definitions"" published in 2008, which provides standard definitions for equity options traded on major exchanges around the world.
3. **EQUITY_OPTION**: This value specifies that the transaction is an equity option, which is a type of financial derivative that gives the holder the right, but not the obligation, to buy or sell a specific underlying equity instrument (e.g., stock) at a predetermined price (strike price) on or before a specified date.
4. **JAPAN**: This value specifies that the transaction takes place in Japan, which has its own unique regulatory environment and market practices for derivatives trading.

When using this `ISDA_2008_EQUITY_OPTION_JAPAN` value with an MCA, it indicates that the agreement governing the equity option transaction is subject to Japanese law and regulations. This ensures that all parties involved in the transaction are aware of their respective obligations and responsibilities under Japanese law.

In summary, the `ISDA_2008_EQUITY_OPTION_JAPAN` value is a specific type of annex that specifies the governing law and regulations for equity options traded on Japanese markets, as defined by ISDA 2008 Equity Option Definitions.","Does the document refer to an agreement governing a transaction in Japan, specifically for equity options as defined by the International Swaps and Derivatives Association (ISDA) 2008 Equity Option Definitions?"
ISDA_2009_CLOSED_MARKETS_OPTIONS_ASIA_EXCLUDING_JAPAN,"I see what's going on here!

This is a code that comes from the International Swaps and Derivatives Association (ISDA) 2009 Master Agreement for OTC Derivatives, specifically the Closed Markets Options Annex.

In simpler terms, it's an identifier used to specify which type of annex (a supporting document) should be used when confirming a transaction governed by the ISDA Master Agreement.

Here's a breakdown:

* `ISDA_2009`: This is the version number of the ISDA Master Agreement being referenced. The 2009 version is a widely-used standard for over-the-counter derivatives transactions.
* `CLOSED_MARKETS_OPTIONS`: This refers to the specific annex (or addendum) that governs the terms and conditions of closed-out options traded in markets where there are no liquid markets or standardized prices.
* `ASIA_EXCLUDING_JAPAN`: This part specifies the geographical region that this annex applies to. In this case, it's Asia, excluding Japan.

So, when you see this code, it means you're dealing with a transaction involving closed-out options traded in Asian markets, excluding Japan, and governed by the ISDA 2009 Master Agreement using the Closed Markets Options Annex.

In summary, this code is an identifier that helps facilitate trade in derivatives markets by specifying which annex to use when confirming transactions.","Does the document refer to the ""ASIA_EXCLUDING_JAPAN"" enum value as the geographical region governed by the Closed Markets Options Annex?"
ISDA_2009_EQUITY_EUROPEAN_IS,"A very specific and technical request!

According to the International Swaps and Derivatives Association (ISDA) 2009 Master Agreement, which is a widely used standard for derivatives contracts, the ISDA_2009_EQUITY_EUROPEAN_IS element specifies the type of annex to be used with a Master Confirmation Agreement governing an equity transaction.

In more detail:

* **IS**: This stands for ""International Swaps and Derivatives Association"".
* **2009**: Refers to the year the ISDA Master Agreement was published, which is widely considered the standard agreement for derivatives contracts.
* **EQUITY**: Indicates that this annex applies specifically to equity transactions (i.e., trades involving stocks or shares).
* **EUROPEAN_IS**: This specifies that the annex will be used in a European context, where specific rules and regulations may apply.

In practical terms, the ISDA_2009_EQUITY_EUROPEAN_IS element is part of the Master Confirmation Agreement (MCA) process for equity derivatives transactions. The MCA is an agreement between two parties that outlines the general terms and conditions governing a series of trades or transactions in a specific type of derivative instrument.

When a trade is executed, it must be confirmed through the MCA process to ensure that both parties agree on the details of the transaction. The ISDA_2009_EQUITY_EUROPEAN_IS element helps determine which annex (or addendum) should be used for each transaction, based on its specific characteristics and the applicable laws and regulations.

In summary, this element is a technical specification that provides a standardized framework for confirming equity derivatives transactions in Europe, ensuring that all parties involved have a clear understanding of the terms and conditions governing the trade.","Does the document contain a reference to an ""International Swaps and Derivatives Association"" with regard to an annex or addendum used in an equity derivatives transaction, specifically mentioning ""European"" rules?"
